{
  "$schema": "sourcegraph-repository-language-inventory.schema.json",
  "inventory_version": 3,
  "case_index_sha256": "8729186a45ca2b46cbe163b1069c3a6998e4cf5abcdcc63b3075c07592d1bf15",
  "source_tranche_sha256": "31009ce5eada3932ccb776b55619b7cf695e081674f9e72294135e6920a3db07",
  "observed_at": "2026-07-29T19:53:52Z",
  "sourcegraph_capability": "Repository.language",
  "sourcegraph_scope": "github.com/sg-evals/*",
  "scip_required": false,
  "index_manifest_sha256": "eb39ec53d2cc73791f7ebef75a4226fdf67be0272017fed2d05ebbbe292b33b5",
  "repository_name_map_sha256": "564e287004a714caf8647031908f2fb18d391bfebd93a6b5034f61987018a4b9",
  "repository_count": 248,
  "review_scope_exception_count": 1,
  "language_counts": {
    "Bru": 1,
    "C": 4,
    "C#": 2,
    "C++": 5,
    "CSV": 1,
    "Dart": 2,
    "Gettext Catalog": 3,
    "Go": 55,
    "JSON": 17,
    "Java": 2,
    "JavaScript": 9,
    "Jupyter Notebook": 1,
    "MDX": 2,
    "Markdown": 9,
    "Python": 78,
    "Rust": 13,
    "SQL": 1,
    "SVG": 1,
    "Shell": 2,
    "Swift": 1,
    "TOML": 1,
    "Text": 1,
    "TypeScript": 31,
    "Vim Script": 1,
    "XML": 1,
    "YAML": 4
  },
  "repositories": [
    {
      "canonical_repository_id": "0xfurai/peekaping",
      "review_sourcegraph_name": "github.com/sg-evals/0xfurai-peekaping",
      "language_sourcegraph_name": "github.com/sg-evals/0xfurai-peekaping",
      "language": "JSON"
    },
    {
      "canonical_repository_id": "2dust/v2rayn",
      "review_sourcegraph_name": "github.com/sg-evals/2dust-v2rayN",
      "language_sourcegraph_name": "github.com/sg-evals/2dust-v2rayN",
      "language": "C#"
    },
    {
      "canonical_repository_id": "a16z/halmos",
      "review_sourcegraph_name": "github.com/sg-evals/a16z-halmos",
      "language_sourcegraph_name": "github.com/sg-evals/a16z-halmos",
      "language": "Python"
    },
    {
      "canonical_repository_id": "addyosmani/agent-skills",
      "review_sourcegraph_name": "github.com/sg-evals/addyosmani-agent-skills",
      "language_sourcegraph_name": "github.com/sg-evals/addyosmani-agent-skills",
      "language": "Markdown"
    },
    {
      "canonical_repository_id": "affaan-m/ecc",
      "review_sourcegraph_name": "github.com/sg-evals/affaan-m-ECC",
      "language_sourcegraph_name": "github.com/sg-evals/affaan-m-ECC",
      "language": "Markdown"
    },
    {
      "canonical_repository_id": "aftership/clickhouse-sql-parser",
      "review_sourcegraph_name": "github.com/sg-evals/aftership-clickhouse-sql-parser",
      "language_sourcegraph_name": "github.com/sg-evals/aftership-clickhouse-sql-parser",
      "language": "Go"
    },
    {
      "canonical_repository_id": "ag2ai/build-with-ag2",
      "review_sourcegraph_name": "github.com/sg-evals/ag2ai-build-with-ag2",
      "language_sourcegraph_name": "github.com/sg-evals/ag2ai-build-with-ag2",
      "language": "Python"
    },
    {
      "canonical_repository_id": "ai-shifu/ai-shifu",
      "review_sourcegraph_name": "github.com/sg-evals/ai-shifu-ai-shifu",
      "language_sourcegraph_name": "github.com/sg-evals/ai-shifu-ai-shifu",
      "language": "Python"
    },
    {
      "canonical_repository_id": "airbytehq/airbyte",
      "review_sourcegraph_name": "github.com/sg-evals/airbytehq-airbyte",
      "language_sourcegraph_name": "github.com/sg-evals/airbytehq-airbyte",
      "language": "YAML"
    },
    {
      "canonical_repository_id": "airbytehq/pyairbyte",
      "review_sourcegraph_name": "github.com/sg-evals/airbytehq-pyairbyte",
      "language_sourcegraph_name": "github.com/sg-evals/airbytehq-pyairbyte",
      "language": "Python"
    },
    {
      "canonical_repository_id": "aldinokemal/go-whatsapp-web-multidevice",
      "review_sourcegraph_name": "github.com/sg-evals/aldinokemal-go-whatsapp-web-multidevice",
      "language_sourcegraph_name": "github.com/sg-evals/aldinokemal-go-whatsapp-web-multidevice",
      "language": "Go"
    },
    {
      "canonical_repository_id": "angular/angular",
      "review_sourcegraph_name": "github.com/sg-evals/angular-angular",
      "language_sourcegraph_name": "github.com/sg-evals/angular-angular",
      "language": "TypeScript"
    },
    {
      "canonical_repository_id": "anomalyco/opencode",
      "review_sourcegraph_name": "github.com/sg-evals/anomalyco-opencode",
      "language_sourcegraph_name": "github.com/sg-evals/anomalyco-opencode",
      "language": "TypeScript"
    },
    {
      "canonical_repository_id": "ansible/ansible",
      "review_sourcegraph_name": "github.com/sg-evals/ansible-ansible",
      "language_sourcegraph_name": "github.com/sg-evals/ansible-ansible",
      "language": "Python"
    },
    {
      "canonical_repository_id": "ant-design/ant-design",
      "review_sourcegraph_name": "github.com/sg-evals/ant-design-ant-design",
      "language_sourcegraph_name": "github.com/sg-evals/ant-design-ant-design",
      "language": "TypeScript"
    },
    {
      "canonical_repository_id": "anuraghazra/github-readme-stats",
      "review_sourcegraph_name": "github.com/sg-evals/anuraghazra-github-readme-stats",
      "language_sourcegraph_name": "github.com/sg-evals/anuraghazra-github-readme-stats",
      "language": "JavaScript"
    },
    {
      "canonical_repository_id": "apache/superset",
      "review_sourcegraph_name": "github.com/sg-evals/apache-superset",
      "language_sourcegraph_name": "github.com/sg-evals/apache-superset",
      "language": "TypeScript"
    },
    {
      "canonical_repository_id": "astral-sh/uv",
      "review_sourcegraph_name": "github.com/sg-evals/astral-sh-uv",
      "language_sourcegraph_name": "github.com/sg-evals/astral-sh-uv",
      "language": "Rust"
    },
    {
      "canonical_repository_id": "axios/axios",
      "review_sourcegraph_name": "github.com/sg-evals/axios-axios",
      "language_sourcegraph_name": "github.com/sg-evals/axios-axios",
      "language": "JavaScript"
    },
    {
      "canonical_repository_id": "aztfmod/terraform-provider-azurecaf",
      "review_sourcegraph_name": "github.com/sg-evals/aztfmod-terraform-provider-azurecaf",
      "language_sourcegraph_name": "github.com/sg-evals/aztfmod-terraform-provider-azurecaf",
      "language": "Go"
    },
    {
      "canonical_repository_id": "azure/azure-dev",
      "review_sourcegraph_name": "github.com/sg-evals/azure-azure-dev",
      "language_sourcegraph_name": "github.com/sg-evals/azure-azure-dev",
      "language": "Go"
    },
    {
      "canonical_repository_id": "azure/azure-kusto-python",
      "review_sourcegraph_name": "github.com/sg-evals/azure-azure-kusto-python",
      "language_sourcegraph_name": "github.com/sg-evals/azure-azure-kusto-python",
      "language": "JSON"
    },
    {
      "canonical_repository_id": "azure/azure-sdk-for-python",
      "review_sourcegraph_name": "github.com/sg-evals/azure-azure-sdk-for-python",
      "language_sourcegraph_name": "github.com/sg-evals/azure-azure-sdk-for-python",
      "language": "Python"
    },
    {
      "canonical_repository_id": "azure/azure-storage-fuse",
      "review_sourcegraph_name": "github.com/sg-evals/azure-azure-storage-fuse",
      "language_sourcegraph_name": "github.com/sg-evals/azure-azure-storage-fuse",
      "language": "Go"
    },
    {
      "canonical_repository_id": "badtuxx/girus-cli",
      "review_sourcegraph_name": "github.com/sg-evals/badtuxx-girus-cli",
      "language_sourcegraph_name": "github.com/sg-evals/badtuxx-girus-cli",
      "language": "YAML"
    },
    {
      "canonical_repository_id": "bayesianbandits/bayesianbandits",
      "review_sourcegraph_name": "github.com/sg-evals/bayesianbandits-bayesianbandits",
      "language_sourcegraph_name": "github.com/sg-evals/bayesianbandits-bayesianbandits",
      "language": "Python"
    },
    {
      "canonical_repository_id": "beehiveinnovations/zen-mcp-server",
      "review_sourcegraph_name": "github.com/sg-evals/beehiveinnovations-zen-mcp-server",
      "language_sourcegraph_name": "github.com/sg-evals/beehiveinnovations-zen-mcp-server",
      "language": "Python"
    },
    {
      "canonical_repository_id": "bespokelabsai/curator",
      "review_sourcegraph_name": "github.com/sg-evals/bespokelabsai-curator",
      "language_sourcegraph_name": "github.com/sg-evals/bespokelabsai-curator",
      "language": "YAML"
    },
    {
      "canonical_repository_id": "bevyengine/bevy",
      "review_sourcegraph_name": "github.com/sg-evals/bevyengine-bevy",
      "language_sourcegraph_name": "github.com/sg-evals/bevyengine-bevy",
      "language": "Rust"
    },
    {
      "canonical_repository_id": "bitcoin/bitcoin",
      "review_sourcegraph_name": "github.com/sg-evals/bitcoin-bitcoin",
      "language_sourcegraph_name": "github.com/sg-evals/bitcoin-bitcoin",
      "language": "C++"
    },
    {
      "canonical_repository_id": "brentyi/jaxls",
      "review_sourcegraph_name": "github.com/sg-evals/brentyi-jaxls",
      "language_sourcegraph_name": "github.com/sg-evals/brentyi-jaxls",
      "language": "Jupyter Notebook"
    },
    {
      "canonical_repository_id": "brevdev/brev-cli",
      "review_sourcegraph_name": "github.com/sg-evals/brevdev-brev-cli",
      "language_sourcegraph_name": "github.com/sg-evals/brevdev-brev-cli",
      "language": "Go"
    },
    {
      "canonical_repository_id": "briangu/klongpy",
      "review_sourcegraph_name": "github.com/sg-evals/briangu-klongpy",
      "language_sourcegraph_name": "github.com/sg-evals/briangu-klongpy",
      "language": "Python"
    },
    {
      "canonical_repository_id": "browser-use/browser-use",
      "review_sourcegraph_name": "github.com/sg-evals/browser-use-browser-use",
      "language_sourcegraph_name": "github.com/sg-evals/browser-use-browser-use",
      "language": "Python"
    },
    {
      "canonical_repository_id": "busser/tfautomv",
      "review_sourcegraph_name": "github.com/sg-evals/busser-tfautomv",
      "language_sourcegraph_name": "github.com/sg-evals/busser-tfautomv",